{
  "brief_hash": "a1b2c3d4",
  "iteration": "001",
  "rubric_name": "writing:v1",
  "rubric_scores": {
    "scores": {
      "structure": 4.2,
      "evidence": 3.1,
      "sentence": 3.6,
      "originality": 3.3
    },
    "weights": {
      "structure": 0.3,
      "evidence": 0.3,
      "sentence": 0.2,
      "originality": 0.2
    },
    "weighted_total": 3.57
  },
  "axis_rationales": {
    "structure": "문제 인식, 시행착오, 역할 분리, MVP 고정, 다음 실험으로 이어지는 흐름이 분명해 글의 논지가 안정적으로 전개된다.",
    "evidence": "runner.py, generator.py, validate.py, MVP 경로 같은 구체 명칭은 있으나 실제 사건이나 관찰의 밀도가 낮아 근거가 다소 개념적이다.",
    "sentence": "문장이 전반적으로 군더더기 없이 읽히고 리듬도 안정적이지만, 표현 패턴이 비슷해 중반부에 약간의 반복감이 있다.",
    "originality": "파일 계약과 역할 분리를 회고의 핵심 교훈으로 잡은 관점은 명확하지만, 발상 자체는 비교적 익숙해 독자적 색채가 아주 강하진 않다."
  },
  "calibration_note": "평균 3.0을 기준으로 보수적으로 채점했으며, 구체성은 충분하지만 실제 에피소드와 수치가 거의 없어 evidence와 originality는 4점 미만으로 유지했다.",
  "evaluated_at": "2026-06-14T16:20:26+09:00",
  "model": "gpt-5.4-mini",
  "metadata": {
    "prompt_version": "eval_system:v1",
    "source_files": [
      "a1b2c3d4_input.json",
      "a1b2c3d4_iter-001_draft.json"
    ],
    "token_usage": {
      "input_tokens": 30584,
      "cached_input_tokens": 16640,
      "output_tokens": 1534,
      "reasoning_output_tokens": 1016
    }
  }
}
